{
  "$schema": "https://json-schema.org/draft/2020-12/schema",
  "title": "Legal Agent Orchestrator Review Meta",
  "type": "object",
  "required": ["approval", "comments", "citation_verification"],
  "properties": {
    "approval": {
      "enum": ["approved", "approved_with_revisions", "revision_needed"]
    },
    "summary": { "type": "string" },
    "comments": {
      "type": "array",
      "items": {
        "type": "object",
        "required": ["severity", "location", "issue", "recommendation"],
        "properties": {
          "severity": { "enum": ["critical", "major", "minor", "suggestion"] },
          "location": { "type": "string" },
          "issue": { "type": "string" },
          "recommendation": { "type": "string" },
          "citation": { "type": "string" },
          "status": { "type": "string" }
        }
      }
    },
    "citation_verification": {
      "type": "array",
      "items": {
        "type": "object",
        "required": ["citation", "status"],
        "properties": {
          "agent_id": { "type": "string" },
          "source_id": { "type": "string" },
          "citation": { "type": "string" },
          "status": { "enum": ["verified", "nonexistent", "unverified", "not_checked"] },
          "method": { "type": "string" },
          "note": { "type": "string" }
        }
      }
    },
    "error": {
      "type": ["object", "null"]
    }
  }
}
