{
  "approval": "approved",
  "summary": "합성 리뷰 승인.",
  "comments": [
    {
      "severity": "minor",
      "location": "1. 결론",
      "issue": "표현을 더 간결히 할 수 있습니다.",
      "recommendation": "문장을 축약합니다.",
      "status": "open"
    }
  ],
  "citation_verification": [
    { "source_id": "dp_src_001", "citation": "제28조의8", "status": "verified", "method": "primary_db" },
    { "source_id": "dp_src_002", "citation": "Article 28", "status": "verified", "method": "primary_db" },
    { "source_id": "gen_src_001", "citation": "Article 25", "status": "verified", "method": "primary_db" }
  ],
  "error": null
}
